{
 "schema_version": "1.1.0",
 "last_attempt_at": "2026-10-15T19:46:19Z",
 "last_outcome": "success",
 "last_success_at": "2026-10-15T19:46:19Z",
 "message": "Data updated. Latest EU reference period 2024; 0 changed, 0 added, 0 removed value(s); 3 validation warning(s).",
 "run_url": "https://github.com/DaLuSt/Vision-Zero-Monitor/actions/runs/38796564514"
}
